Company Name,E-Mail,Phone Number,Website,Direct book,Categories,Locations
A. Gary Anderson Graduate School of Management,,,http://agsm.ucr.edu/,No,A. Gary Ander,Riverside | Riverside
California State University East Bay,,,http://www20.csueastbay.edu,No,California St,Hayward | 25800 Carlos Bee Blvd VBT 129Hayward California 94542United States
CareerFoundry,,,,No,CareerFoundry,Berlin | Germany
California State University Long Beach,,,http://www.csulb.edu/colleges/cba/,No,California St,Long Beach | 1250 Bellflower Blvd.Long Beach California 90840United States
Carey Business School,,,http://carey.jhu.edu/,No,Carey Busines,Baltimore | Baltimore
Cameron School of Business,,,http://www.csb.uncw.edu/,No,Cameron Schoo,Wilmington | Wilmington
Bryan School of Business and Economics,,,http://bae.uncg.edu/,No,Bryan School,Greensboro | Greensboro
Bryant University College of Business,,,http://www.bryant.edu/academics/colleges/college-of-business/,No,Bryant Univer,Smithfield | 1150 Douglas PikeSmithfield Rhode Island 02917United States
Business Administration Department,,,http://www.mia.albizu.edu/web/academic_programs/school_of_business.asp,No,Business Admi,Miami | Miami
Brandeis International Business School,,,,No,Brandeis Inte,Waltham | Waltham
Bowling Green State University College of Business,,,http://www.business.bgsu.edu/,No,Bowling Green,Bowling Green | Bowling Green | Bowling Green
Boston University School of Management,,,http://www.management.bu.edu,No,Boston Univer,Boston | Boston
BMGI - Problem Solved,,,http://www.bmgi.com,No,BMGI - Proble,Denver | Tabor Center 1200 17Th Street Suite 180 (Ground Floor)Denver Colorado 80202United States
Canvas Network,,,https://www.canvas.net/,No,Canvas Network,SLC UT United States | SLC UT United States | SLC UT United States
Biola University Crowell School of Business,,,http://crowell.biola.edu/,No,Biola Univers,La Mirada | La Mirada
Yale School of Management,,,http://mba.yale.edu/index.shtml,No,Yale School o,New Haven | New Haven
Wright State University,,,http://www.wright.edu/,No,Wright State,Dayton | 133 Allyn Hall 3640 Colonel Glenn HighwayDayton Ohio 45435United States
WPI School Of Business,,,http://www.wpi.edu,No,WPI School Of,Worcester | 100 Institute RoadWorcester Massachusetts 01609United States
Carl H. Lindner College of Business,,,http://business.uc.edu/,No,Carl H. Lindn,Cincinnati | Hyatt Regency Denver At Colorado Convention Center 650 Fifteenth StreetDenver Colorado 80202United States
Zicklin School of Business,,,http://zicklin.baruch.cuny.edu/,No,Zicklin Schoo,NY | Weissman Center for International Business One Bernard Baruch Way Box J-0810New York New York 10010United States
W. P. Carey School,,,http://wpcarey.asu.edu/,No,W. P. Carey S,Tempe | 7171 E. Sonoran Arroyo MallMesa Arizona 85212United States
Wisconsin School of Business,,,http://bus.wisc.edu/,No,Wisconsin Sch,Madison | 601 University AveMadison Wisconsin 53715United States
WHU - Otto Beisheim School of Management,,,,No,WHU - Otto Be,Vallendar Germany | Burgplatz 2Vallendar 56179Germany | Vallendar Germany | Vallendar Germany
Williams College of Business,,,http://www.xavier.edu/williams/,No,Williams Coll,Cincinnati | 3800 Victory ParkwayCincinnati Ohio 45207United States
Widener University School of Business Administration,,,http://www.widener.edu,No,Widener Unive,Chester | Schwartz Center One University PlaceChester Pennsylvania 19013United States
Woodbury University,,,http://woodbury.edu/,No,Woodbury Univ,Burbank | 7500 Glenoaks BoulevardBurbank California 91504United States
West Texas A&M University College of Business,,(806) 651-4403(806) 651-4409,http://www.wtamu.edu/academics/general-business-grad-program.aspx,No,West Texas A&amp;,Canyon | WTAMU Box 60049Canyon Texas 79016United States
Whittemore School of Business and Economics University of New Hampshire,,,http://www.paulcollege.unh.edu,No,Whittemore Sc,Durham | Durham
Western New England University College of Business,,,http://www1.wne.edu,No,Western New E,Springfield | Springfield
Wharton School University of Pennsylvania,,,http://www.wharton.upenn.edu,No,Wharton Schoo,Philadelphia | Philadelphia
W. Fielding Rubel School of Business Bellarmine University,,,http://www.bellarmine.edu,No,W. Fielding R,Louisville | 2001 Newburg RoadLouisville Kentucky 40205United States
West Virginia University College of Business and Economics,,,http://www.be.wvu.edu/,No,West Virginia,Morgantown | Morgantown
Washington State University College of Business,,,http://www.business.wsu.edu/,No,Washington St,WA 99164-4750 | WA 99164-4750
Weatherhead School of Management,,,http://weatherhead.case.edu/,No,Weatherhead S,Cleveland | 11119 Bellflower RdCleveland Ohio 44106United States
Warsaw University of Technology Business School,,,http://www.business.edu.pl/,No,Warsaw Univer,Warsaw | Warsaw
Washburn University,,,http://www.washburn.edu,No,Washburn Univ,Topeka | 1700 SW CollegeTopeka Kansas 66621United States
VCU School of Business,,,http://business.vcu.edu,No,VCU School of,Richmond | Richmond
Villanova School of Business Villanova University,,,http://www.villanova.edu,No,Villanova Sch,Villanova | Jake Nevin Field House 800 Lancaster AvenueVillanova Pennsylvania 19085United States
W. A. Franke College of Business Northern Arizona University,,,http://www.franke.nau.edu/,No,W. A. Franke,Flagstaff | Flagstaff
Binghamton University School of Management,,,http://www.binghamton.edu,No,Binghamton Un,Binghamton | 2200 Vestal RdVestal New York 13850United States
West Texas A&M University College of Business,,(806) 651-4403(806) 651-4409,http://www.wtamu.edu/academics/general-business-grad-program.aspx,No,West Texas A&amp;,Canyon | WTAMU Box 60049Canyon Texas 79016United States
Wayne State University School of Business Administration,,,http://business.wayne.edu/,No,Wayne State U,Detroit | Detroit
Warrington College of Business Administration University of Florida,,,http://www.warrington.ufl.edu/,No,Warrington Co,Gainesville | Gainesville
Valparaiso University College of Business,,,http://www.valpo.edu/cba/,No,Valparaiso Un,Valparaiso | 1700 Chapel DriveValparaiso Indiana 46383United States
UNT College of Business,,,http://www.cob.unt.edu/,No,UNT College o,Denton | 1307 W. Highland - BLB Suite # 215Denton Texas 76201United States
University of Virginia Darden School of Business,,,http://www.darden.virginia.edu/web/Home/,No,University of,Charlottesville | Charlottesville
University of Wyoming College of Business,,,http://www.uwyo.edu/business/,No,University of,Laramie | 1000 E. University Ave.  Dept. 3414Laramie Wyoming 82071United States
University of Tulsa Collins College of Business,,,http://www.utulsa.edu/academics/colleges/collins-college-of-business.aspx,No,University of,Tulsa | 800 Tucker Drive Collins Hall #2170Tulsa Oklahoma 74104United States
University of Texas-Pan American College of Business Administration,,,http://portal.utpa.edu/utpa_main/daa_home/coba_new_home,No,University of,Edinburg | Edinburg
University of Texas College of Business Administration,,,http://business.utep.edu/,No,University of,El Paso | El Paso
University of Texas at Arlington College of Business,,,http://www.uta.edu/business/,No,University of,Arlington | 202 E. Border St. Suite 319Arlington Texas 76019United States
Unversity of Vermont School of Business Administration,,,http://www.uvm.edu,No,Unversity of,Burlington | 111 Colchester AveBurlington Vermont 05401United States
University of Tennessee at Chattanooga College of Business,,,http://www.utc.edu/Academic/Business/,No,University of,Chattanooga | 615 McCallie AvenueChattanooga Tennessee 37403United States
University of Toledo College of Business and Innovation,,,http://www.utoledo.edu/business/,No,University of,Toledo | 2801 W. BancroftToledo Ohio 43606United States
University of South Florida St. Petersburg College of Business,,,,No,University of,St Petersburg
University of South Florida College of Business,,,http://business.usf.edu/,No,University of,Tampa | Tampa
University of Tennessee College of Business Administration,,,http://bus.utk.edu/cba/,No,University of,Knoxville | Knoxville
University of San Francisco School of Business and Management,,,http://www.usfca.edu,No,University of,San Francisco | 2130 Fulton StreetSan Francisco California 94117United States
University of Rhode Island College of Business Administration,,,http://www.cba.uri.edu/,No,University of,Kingston | Kingston
University of Southern Mississippi College of Business,,,http://www.usm.edu/gulfcoast/business,No,University of,Long Beach | 118 College Dr # 5035Hattiesburg Mississippi 39406United States
University of South Dakota,,,http://www.usd.edu,No,University of,Vermillion | 414 East Clark StreetVermillion South Dakota 57069United States
University of San Diego School of Business Administration,,,http://www.sandiego.edu,No,University of,San Diego | 5998 Alcala ParkSan Diego California 92110United States
University of Portland Pamplin School of Business,,,http://business.up.edu/,No,University of,Portland | Portland
University of Otago,,,http://www.otago.ac.nz/,No,University of,North Dunedin New Zealand | North Dunedin New Zealand | North Dunedin New Zealand
University of Richmond Robins School of Business,,,http://robins.richmond.edu/,No,University of,Richmond | Richmond
University of North Dakota College of Business and Public Administration,,,http://business.und.edu/,No,University of,Grand Forks | 293 Centennial Drive Stop 8098 Gamble Hall Room 120Grand Forks North Dakota 58202United States
University of Nevada College of Business,,,http://www.unr.edu/business/,No,University of,Reno | 1664 North Virginia St.Reno Nevada 89557United States
University of Montana School of Business Administration,,,http://www.umt.edu,No,University of,Missoula | 32 Campus DriveMissoula Montana 59812United States
University of Mississippi School of Business Administration University of Mississippi,,,http://www.olemissbusiness.com,No,University of,Ofxord | 320 Holman HallUniversity Mississippi 38677United States
University of New Orleans College of Business Administration,,,http://www.uno.edu/coba/index.aspx,No,University of,New Orleans | 2000 Lake Shore DriveNew Orleans Louisiana 70148United States | New Orleans | New Orleans
University of Miami School of Business Administration,,,http://www.bus.miami.edu/,No,University of,Coral Gables | Coral Gables
University of Mary Washington College of Business,,,http://business.umw.edu,No,University of,Fredericksburg | Fredericksburg
University of Massachusetts Dartmouth Charlton College of Business,,(508) 999-8000(508) 910-6918,http://www.umassd.edu/charlton/,No,University of,North Dartmouth | 285 Old Westport Rd.N. Dartmouth Massachusetts 02747United States
University of Idaho College of Business and Economics,,,http://www.uidaho.edu/cbe,No,University of,Moscow | 875 Perimeter DriveMoscow Idaho 83844United States
University of Louisville College of Business,,,http://business.louisville.edu/,No,University of,Louisville | Louisville
University of Dubuque,,,http://www.dbq.edu,No,University of,Dubuque | 2000 University AvenueDubuque Iowa 52001United States
University of Detroit Mercy College of Business Administration,,,http://business.udmercy.edu/index.htm,No,University of,Detroit | Detroit
University of Houston-Clear Lake,,,http://prtl.uhcl.edu,No,University of,Houston | Houston
University of Dallas College of Business,,,http://www.udallas.edu/cob/,No,University of,Irving | 1845 E NorthgateIrving Texas 75062United States
University of Illinois Urbana-Champaign College of Business,,,http://www1.business.illinois.edu/,No,University of,Champaign | Champaign
University of Dayton School of Business Administration,,,http://www.udayton.edu,No,University of,Dayton | 300 College ParkDayton Ohio 45469United States
University of Central Florida College of Business Administration,,,http://www.bus.ucf.edu/,No,University of,Orlando
University of Amsterdam,,,http://www.uva.nl/en/home,No,University of,Amsterdam | Spui 21Amsterdam 1012 WXNetherlands
University of Houston School of Continuing & Professional Studies,,,http://www.gatlineducation.com/houston_univ/index.htm,No,University of,Temecula CA United States | 109 East 3Rd Street  Suite 350Fort Worth Texas 76102United States | Temecula CA United States | Temecula CA United States
University of Akron College of Business Administration,,,http://www.uakron.edu/cba/cba-home/index.dot,No,University of,Akron | 373 Carroll St.Akron Ohio 44325United States
University at Buffalo The State University of New York School of Management,,,http://www.mgt.buffalo.edu,No,University at,Buffalo
University of Cambridge Institute of Continuing Education,,,,No,University of | Archaeology | European Archaeology | Writing | Travel Writing | Paleography,Cambridge United Kingdom | You study this on your computer | You study this on your computer | Cambridge CB23 8AQ
Universita de Pisa Business School,,,http://www.unipi.it/index.php/english,No,Universita de,Pisa Italy
US Small Business Administration,,,http://www.sba.gov,No,US Small Busi,Washington | 409 Third St. S.W.Washington District of Columbia 20416United States
Universidad Carlos III de Madrid,,,http://www.uc3m.es/mba,No,Universidad C,Getafe | C/ Madrid 126Getafe Madrid 28903Spain
UHD College of Business,,,http://www.uhd.edu/academic/colleges/business/,No,UHD College o,Houston | Houston
UHV School of Business Administration,,,http://www.uhv.edu,No,UHV School of,Victoria | Victoria
UCONN School of Business,,,http://uconn.edu/,No,UCONN School,Storrs | 263 Farmington AvenueFarmington Connecticut 06030United States
Udacity,,,https://www.udacity.com/,No,Udacity,Palo Alto CA United States | 2465 Latham StMountain View California 94040United States | Palo Alto CA United States | Palo Alto CA United States
University of Business and Technology,,,http://www.mba-cba.edu.sa,No,University of,Jeddah | Jeddah
UCLA Anderson School of Management University of California Los Angeles,,,http://www.anderson.ucla.edu,No,UCLA Anderson,Los Angeles | 8140 E County Line RdRogersville Missouri 65742United States
UCLA Summer Sessions Online Courses,,,http://www.online.ucla.edu/,No,UCLA Summer S,
UAB School of Business,,,http://www.uab.edu,No,UAB School of,Birmingham | 150 Hill University Center   1400 University BoulevardBirmingham Alabama 35294United States
Trulaske College of Business University of Missouri,,,http://www.business.missouri.edu/,No,Trulaske Coll,Columbia | Columbia
UC Irvine OpenCourseWare,,,http://ocw.uci.edu/courses/index.aspx,No,UC Irvine Ope,Irvine CA United States | Irvine CA United States | Irvine CA United States
Treehouse,,,http://teamtreehouse.com/,No,Treehouse,622 E Washington Street Suite 240Orlando Florida 32801United States
UC Davis Graduate School of Management,,,http://gsm.ucdavis.edu/,No,UC Davis Grad,Davis | Davis
UC Berkeley Extension,,,http://extension.berkeley.edu/,No,UC Berkeley E,Berkeley CA United States | Berkeley CA United States | Berkeley CA United States
Touro Graduate School of Business,,,http://legacy.touro.edu/gsb/,No,Touro Graduat,New York | New York
The University of Tennessee Martin,,(731) 881-7000(731) 881-7029,http://www.utm.edu/departments/mba/,No,The Universit,Martin Tennessee USA | 544 University StreetMartin Tennessee 38238United States
The University of Chicago Booth School of Business,,,http://www.chicagobooth.edu/,No,The Universit,Chicago | 5000 W. Roosevelt Road.Chicago Illinois 60644United States
The University of Texas at El Paso College of Business Administration,,,http://www.mba.utep.edu,No,The Universit,El Paso
TIAS School for Business and Society,,,http://www.tias.edu,No,TIAS School f,Tilburg | Tilburg
Thunderbird School of Global Management,,,http://www.thunderbird.edu/,No,Thunderbird S,Glendale | 1 Global PlaceGlendale Arizona 85306United States
The Peter J. Tobin College of Business St. John's University,,,http://www.stjohns.edu,No,The Peter J.,Queens | 8000 Utopia ParkwayQueens New York 11439United States
The Manning School of Business University of Massachusetts Lowell,,,http://www.uml.edu,No,The Manning S,Lowell | One University AvenueLowell Massachusetts 01854United States
The Cyprus Institute of Marketing,,,http://www.cima.ac.cy/,No,The Cyprus In,Nicosia | Nicosia
The James F. Dicke College of Business Administration,,,http://www.onu.edu/academics/college_business_administration,No,The James F.,Ada | 525 S. Main St.Ada Ohio 45810United States
The Open University,,,http://www.openuniversity.edu/,No,The Open Univ,Milton Keynes | Milton Keynes
The Belk College of Business,,,,No,The Belk Coll,Charlotte | 9201 University City Blvd.Charlotte North Carolina 28223United States
The Joseph A. Butt S.J. College of Business Loyola University New Orleans,,,http://www.business.loyno.edu/,No,The Joseph A.,New Orleans
The Lisbon MBA International,,,http://www.TheLisbonMBA.com,No,The Lisbon MB,Lisboa | 50 Memorial DriveCambridge Massachusetts 02142United States
Texas Wesleyan University School of Business Administration,,,http://www.txwes.edu/,No,Texas Wesleya,Fort Worth | 1201 Wesleyan St.Fort Worth Texas 76105United States
Terry College of Business University of Georgia,,,http://www.terry.uga.edu,No,Terry College,Athens | 3475 Lenox Road NE  Room 306Atlanta Georgia 30326United States
Suffolk University,,,http://www.suffolk.edu,No,Suffolk Unive,Boston | 120 Tremont StreetBoston Massachusetts 02108United States
The DeVille School of Business Walsh University,,,http://www.walsh.edu/campus-map-directions,No,The DeVille S,North Canton | 2020 East Maple StreetNorth Canton Ohio 44720United States
State University Of New York Institute of Technology at Utica/Rome (SUNYIT),,,http://www.sunyit.edu,No,State Univers,Utica | 100 Seymour RoadUtica New York 13502United States
Stern School of Business New York University,,,http:///www.stern.nyu.edu,No,Stern School,New York | New York
Stillman School of Business Seton Hall University,,,http://www.shu.edu/academics/business/,No,Stillman Scho,South Orange | 400 South Orange AvenueSouth Orange New Jersey 07079United States
Stuart School of Business Illinois Institute of Technology,,,http://www.stuart.iit.edu,No,Stuart School,Chicago | Chicago
Stanford Graduate School of Business,,,http://www.gsb.stanford.edu/,No,Stanford Grad,Stanford | Stanford
Spears School of Business,,,http://spears.okstate.edu/,No,Spears School,Stillwater | 201L Business BuildingStillwater Oklahoma 74078United States
Southern University College of Business,,,http://www.subr.edu/index.cfm/page/116,No,Southern Univ,Baton Rouge | 6400 Press DriveNew Orleans Louisiana 70126United States
SMU Cox School of Business,,,http://www.cox.smu.edu/web/guest/home;jsessionid=25992EA40C33F831EC4CDBB5442BEA65,No,SMU Cox Schoo,Dallas | 200 Fincher Building 6212 Fincher Blvd.Dallas Texas 75275United States
Stanford Online,,,http://online.stanford.edu/,No,Stanford Online,Stanford California United States | Stanford California United States | Stanford California United States
Stanford University Open Classroom,,,http://openclassroom.stanford.edu/,No,Stanford Univ,Stanford CA United States | Stanford CA United States | Stanford CA United States
Smeal College of Business Penn State University,,,http://www.smeal.psu.edu,No,Smeal College,University Park | 801 Business Administration BuildingUniversity Park Pennsylvania 16802United States
SIUE School of Business,,,http://www.siue.edu,No,SIUE School o,Edwardsville | Edwardsville
Simon Graduate School of Business,,,http://www.simon.rochester.edu/index.aspx,No,Simon Graduat,Rochester | 304 Schlegel HallRochester New York 14627United States
Shidler College of Business University of Hawaii at Manoa,,,http://www.shidler.hawaii.edu/,No,Shidler Colle,Honolulu | 2404 Maile Way #E402Honolulu Hawaii 96822United States
Sellinger School of Business and Management Loyola University Maryland,,,http://www.loyola.edu/sellinger.aspx,No,Sellinger Sch,Baltimore | WBB Camp 4501 North Charles StreetBaltimore Maryland 21210United States
Southern Illinois University College of Business,,,http://www.business.siu.edu/,No,Southern Illi,Carbondale | Carbondale
School of Management New Jersey Institute of Technology,,,http://www.management.njit.edu/,No,School of Man,Newark | Newark
Seidman College of Business Grand Valley State University,,,http://www.gvsu.edu/business/,No,Seidman Colle,Grand Rapids | 1 Campus Dr. FH 97Allendale Michigan 49401United States
Silberman College of Business Fairleigh Dickinson University,,,http://www.fduinfo.com,No,Silberman Col,Madison | Madison
School of Business Clayton State University,,,http://www.clayton.edu,No,School of Bus,Morrow | 2000 Clayton State Blvd.Morrow Georgia 30260United States
Skillfeed,,,https://www.skillfeed.com/,No,Skillfeed,
San Francisco State University College of Business,,,http://cob.sfsu.edu/,No,San Francisco,San Francisco | San Francisco
San Diego State University's College of Business Administration,,,http://cbaweb.sdsu.edu/,No,San Diego Sta,San Diego | San Diego
Saint Peter's University School of Business Administration,,,http://www.saintpeters.edu,No,Saint Peter&#x27;s,Jersey City | Jersey City
Samuel Curtis Johnson Graduate School of Management,,,http://www.johnson.cornell.edu/,No,Samuel Curtis,Ithaca | Ithaca
Sam M. Walton College of Business,,,http://waltoncollege.uark.edu/,No,Sam M. Walton,Fayetteville | 301 Business BuildingFayetteville Arkansas 72701United States
Rutgers Business School-Newark and New Brunswick,,,http://business.rutgers.edu,No,Rutgers Busin,Piscataway | 991 One Washington ParkNewark New JerseyUnited States
Ross School of Business,,,http://www.bus.umich.edu/,No,Ross School o,Ann Arbor | 701 Tappan St.Ann Arbor Michigan 48109United States
Rotterdam School of Management Erasmus University (RSM),,,http://www.rsm.nl/execed
http://www.rsm.nl/mcc,No,Rotterdam Sch,Rotterdam
Robert H. Smith School of Business,,,http://www.rhsmith.umd.edu,No,Robert H. Smi,College Park | 2416 Van Munching HallCollege Park Maryland 20742United States
Robert Morris School of Business Administration,,,http://www.robertmorris.edu,No,Robert Morris,Chicago | 401 S. State StreetChicago Illinois 60605United States
saylor.org,,,http://www.saylor.org,No,saylor.org,Washington | 1000 Wisconsin Avenue NW Suite 220Washington DC District of Columbia 20007United States | Washington | Washington
Robert B. Willumstad School of Business,,,http://business.adelphi.edu,No,Robert B. Wil,Garden City | Garden City
Robert G. Merrick School of Business,,,http://www.ubalt.edu,No,Robert G. Mer,Baltimore | 1420 N. Charles StreetBaltimore Maryland 21201United States
Rawls College of Business,,,http://imba.ba.ttu.edu/,No,Rawls College,Lubbock | Lubbock
Richard T. Farmer School of Business,,,http://www.fsb.miamioh.edu,No,Richard T. Fa,Oxford | Oxford
Rady School of Management,,,http://rady.ucsd.edu,No,Rady School o,La Jolla | 9500 Gilman Dr. MC 0093La Jolla California 92093United States
Skillshare,,,http://www.skillshare.com/,No,Skillshare,407 Broome St.New York New York 10013United States
PSG Institute of Management,,,http://psgim.ac.in/,No,PSG Institute,Tamil Nadu India | PB NO. 1668 PeelameduCoimbatore Tamil Nadu 641004India | Tamil Nadu India | Tamil Nadu India
Porto Business School,,,http://www.pbs.up.pt/?page_id=837,No,Porto Busines,Porto PORTUGAL | Avenida Fabril do Norte425 Senhora da HoraPorto Matosinhos 4460-312Portugal | Porto PORTUGAL | Porto PORTUGAL
Richard T. Doermer School of Business and Management Sciences,,,http://new.ipfw.edu/,No,Richard T. Do,Fort Wayne | Fort Wayne
Portland State University School of Business Administration,,,http://www.mba.pdx.edu,No,Portland Stat,Oregon Portland
Philadelphia University School of Business Administration,,,http://www.philau.edu,No,Philadelphia,Philadelphia | 4201 Henry AvenuePhiladelphia Pennsylvania 19144United States
Udemy,,,https://www.udemy.com/,No,Udemy,San Francisco CA | 425 Second Street Suite 250San Francisco California 94107United States | San Francisco CA | San Francisco CA
Projectmanagement-training.nl,,,,No,Projectmanage,Amsterdam | Amsterdam
Penn State Behrend College,,,https://psbehrend.psu.edu,No,Penn State Be,Erie | Erie
Peking University Guanghua School of Management,,,http://mba.pku.edu.cn/english,No,Peking Univer,Beijing
Pamplin College of Business,,,http://www.pamplin.vt.edu,No,Pamplin Colle,Blacksburg | Blacksburg
Paul Merage School of Business,,,http://merage.uci.edu,No,Paul Merage S,Irvine | 200 SB2 Building 221Irvine California 92697United States
Professional Development Training USA / pdtraining,,,,No,Professional,Addison | Addison
Peter F. Drucker and Masatoshi Ito Graduate School of Management,,,http://www.cgu.edu,No,Peter F. Druc,Claremont | 101 S. Mills AveClaremont California 91711United States
Othman Yeop Abdullah Graduate School of Business,,,http://www.oyagsb.uum.edu.my/,No,Othman Yeop A,Kedah Malaysia | Kedah Malaysia | Kedah Malaysia
Owen Graduate School of Management,,,http://www.owen.vanderbilt.edu/vanderbilt/,No,Owen Graduate,Nashville | Nashville
Palumbo Donahue School of Business,,,http://www.duq.edu/academics/schools/business#/1,No,Palumbo Donah,Pittsburgh | A.J. Palumbo Center 600 Forbes AvenuePittsburgh Pennsylvania 15282United States
Pacific Lutheran University,,,http://www.plu.edu,No,Pacific Luthe,Tacoma | 12180 Park Ave STacoma Washington 98447United States
Oregon State University College of Business,,,http://business.oregonstate.edu/,No,Oregon State,Corvallis | Corvallis
Orfalea College of Business,,,http://www.cob.calpoly.edu/,No,Orfalea Colle,San Luis Obispo | 1 Grand AvenueSan Luis Obispo California 93407United States
P2PU,,,https://www.p2pu.org,No,P2PU,BarcelonaSpain
Oral Roberts University,,,http://www.oru.edu,No,Oral Roberts,Tulsa | 7777 South Lewis AvenueTulsa Oklahoma 74171United States
Olin Business School,,,http://www.olin.wustl.edu/Pages/default.aspx,No,Olin Business,Saint Louis | One Brookings Drive Campus Box 1133Saint Louis Missouri 63130United States
