Company Name,E-Mail,Phone Number,Website,Direct book,Categories,Locations
John Cook School of Business,,,http://business.slu.edu/,No,John Cook Sch,St. Louis | St. Louis
J. Mack Robinson College of Business,,,http://robinson.gsu.edu/index.html,No,J. Mack Robin,Atlanta | Atlanta
Jesse H. Jones Graduate School of Management,,,http://business.rice.edu/,No,Jesse H. Jone,Houston | Houston
John F. Welch College of Business,,,http://www.sacredheart.edu/academics/johnfwelchcollegeofbusiness/,No,John F. Welch,Fairfield | Fairfield
JMU College of Business,,,http://www.jmu.edu/cob/,No,JMU College o,Harrisonburg | Harrisonburg
Jesse H. Jones School of Business,,,http://www.tsu.edu/academics/colleges__schools/Jesse_H_Jones_School_of_Business/,No,Jesse H. Jone,Houston | Houston
Jay S. Sidhu School of Business and Leadership,,,http://www.wilkes.edu/pages/374.asp,No,Jay S. Sidhu,Wilkes-Barre | Wilkes-Barre
Jackson State University College of Business,,,http://www.jsums.edu/business/,No,Jackson State,Jackson | Jackson
James M. Hull College of Business,,,http://hull.aug.edu/,No,James M. Hull,Augusta | Augusta
Isenberg School of Management,,,http://www.isenberg.umass.edu/,No,Isenberg Scho,Amherst | Amherst
International University of Japan Graduate School of International Managment,,,http://gsim.iuj.ac.jp/,No,International,Kokusai-cho Minami Uonuma-shi
Iowa State College of Business,,,http://www.business.iastate.edu/,No,Iowa State Co,Ames | Ames
International Institute for Learning Inc.,,,http://iil.com/leansixsigma,No,International,New York
Idaho State University College of Business,,,http://isu.edu/cob/,No,Idaho State U,Pocatello | Pocatello
IE Business School,,,,No,IE Business S,Madrid SPAIN | Madrid SPAIN
Hult International Business School,,,http://www.hult.edu/,No,Hult Internat,Cambridge | Cambridge
Huizenga Business School,,,http://www.huizenga.nova.edu/,No,Huizenga Busi,Fort Lauderdale-Davie | Fort Lauderdale-Davie
Illinois State University College of Business,,,http://business.illinoisstate.edu/,No,Illinois Stat,Normal | Normal
Lynda,,,,No,Lynda | Animation | Maya,Hampshire | Hampshire | You study this on your computer
Henry W. Bloch School of Business and Public Administration,,,http://bloch.umkc.edu/,No,Henry W. Bloc,Kansas City | Kansas City
HHL Leipzig Graduate School of Management,,,http://www.hhl.de/nc/en/,No,HHL Leipzig G,Leipzig | Leipzig
Haworth College of Business,,,http://www.wmich.edu/business/,No,Haworth Colle,Kalamazoo | Kalamazoo
Harvard Business School,,,http://www.hbs.edu/Pages/default.aspx,No,Harvard Busin,Boston | Boston
Hamline University School of Business,,,http://www.hamline.edu/business/,No,Hamline Unive,Saint Paul | Saint Paul
Hankamer School of Business,,,http://www.baylor.edu/business/,No,Hankamer Scho,Waco | Waco
Harvard Extension School,,,http://www.extension.harvard.edu/,No,Harvard Exten,Cambridge MA United States | Cambridge MA United States | Cambridge MA United States
Hagan School of Business,,,http://www.iona.edu/academic/hagan/,No,Hagan School,New Rochelle | New Rochelle
Governors State University College of Business and Public Administration,,,http://www.govst.edu/cbpa/,No,Governors Sta,University Park | University Park
Haas School of Business,,,http://www.haas.berkeley.edu/,No,Haas School o,Berkeley | Berkeley
Graziadio School of Business and Management,,,http://bschool.pepperdine.edu/,No,Graziadio Sch,Los Angeles | Los Angeles
Georgia Southern University College of Business Administration (,,,http://coba.georgiasouthern.edu/,No,Georgia South,Statesboro | Statesboro
George Washington School of Business,,,http://business.gwu.edu/,No,George Washin,
Graham School of Continuing Liberal and Professional Studies,,,https://grahamschool.uchicago.edu,No,Graham School,Chicago | Chicago
Goizueta Business School,,,http://goizueta.emory.edu/,No,Goizueta Busi,Atlanta | Atlanta
Georgia Institute of Technology,,,http://scheller.gatech.edu,No,Georgia Insti,Atlanta | Atlanta
Gatton College of Business and Economics,,,http://gatton.uky.edu/,No,Gatton Colleg,Lexington | Lexington
George L. Argyros School of Business and Economics,,,http://www.chapman.edu/asbe/index.aspx,No,George L. Arg,Orange | Orange
George Fox University School of Management,,,http://www.georgefox.edu,No,George Fox Un,Newberg | Newberg
F.W. Olin Graduate School of Business,,,http://www.babson.edu/graduate/Pages/home.aspx,No,F.W. Olin Gra,Babson Park | Babson Park
Frank G. Zarb School of Business,,,http://www.hofstra.edu/Academics/Colleges/Zarb/index.html,No,Frank G. Zarb,Hempstead | Hempstead
Freeman School of Business,,,http://www.freeman.tulane.edu/,No,Freeman Schoo,New Orleans | New Orleans
Fordham University Graduate School of Business,,,http://www.bnet.fordham.edu/,No,Fordham Unive,New York | New York
Fox School of Business,,,http://www.fox.temple.edu/,No,Fox School of,Philadelphia | Philadelphia
Florida State University College of Business,,,http://www.cob.fsu.edu/,No,Florida State,Tallahassee | Tallahassee
Florida International University Chapman Graduate School of Business,,,http://imba.fiu.edu,No,Florida Inter,Miami
Fogelman College of Business and Economics,,,http://www.memphis.edu/fcbe/,No,Fogelman Coll,Memphis | Memphis
Foster College of Business Administration,,,http://www.bradley.edu/academic/colleges/fcba/,No,Foster Colleg,Peoria | Peoria
Florida International University College of Business,,,http://business.fiu.edu/,No,Florida Inter,Miami | Miami
IPAG Business School,,,,No,IPAG Business,Paris France | Paris France | Paris France
City University London Cass Business School,,,,No,City Universi,London
GLOBALCADEMY.COM,,,http://www.globalcademy.com/course/salary-negotiation/,No,Architecture Building &amp; Planning | North America | Europe | Marketing &amp; Sales | Accountancy &amp; Finance | Scotland | North East | North West | South West | West Midlands | Business &amp; Management,Online | Online
LIVERPOOL JOHN MOORES UNIVERSITY,,0151 231 5090,https://www.ljmu.ac.uk/study/courses/postgraduates/pgde-design-technology,No,Animal &amp; Agriculture | Architecture Building &amp; Planning | Accountancy &amp; Finance | Sport &amp; Fitness | Geography Environment &amp; Sustainability | Languages &amp; Literature | Art &amp; Design | Social Sciences &amp; Humanities | Marketing &amp; Sales | Media &amp; Journalism | Maths &amp; Science | Law | Medicine &amp; Health | Travel &amp; Hospitality | Performing Arts | Liverpool | North West | Business &amp; Management,Liverpool | Liverpool Business School | Liverpool School of Art and Design | School of Education | Built Environment | Engineering Technology and Maritime Operations | Distance learning | Nursing and Allied Health | Natural Sciences and Psychology | Faculty of Engineering and Technology | School of Law | Sport and Exercise Sciences | Liverpool Screen School | Centre for Public Health | Sport Studies Leisure and Nutrition | Humanities and Social Science | Computing and Mathematical Sciences | Astrophysics Research Institute | Pharmacy and Biomolecular Sciences | Sport Studies Leisure and Nutrition
UNIVERSITY OF CENTRAL LANCASHIRE,,01772 892400,http://www.uclan.ac.uk/courses/ma_creative_thinking.php,No,Social Sciences &amp; Humanities | Law | Art &amp; Design | Sport &amp; Fitness | Medicine &amp; Health | Languages &amp; Literature | Geography Environment &amp; Sustainability | Marketing &amp; Sales | Media &amp; Journalism | Maths &amp; Science | Travel &amp; Hospitality | Performing Arts | Accountancy &amp; Finance | Architecture Building &amp; Planning | Wales | Preston | North West | Business &amp; Management | Lancaster,Preston | Online | Distance learning | Tyn Dwr | Burnley | Burnley
ESCP EUROPE,,+44 (0)20 7443 8854,https://ad.doubleclick.net/ddm/clk/304017227;131357060;n,No,Animal &amp; Agriculture | Europe | Business &amp; Management,London &amp; Paris | London &amp; Paris
COVENTRY UNIVERSITY,,+44 (0) 24 7765 2222,main,No,Media &amp; Journalism | Medicine &amp; Health | Languages &amp; Literature | Social Sciences &amp; Humanities | Geography Environment &amp; Sustainability | Marketing &amp; Sales | Maths &amp; Science | Law | Sport &amp; Fitness | Travel &amp; Hospitality | Performing Arts | West Midlands,Coventry | Coventry
SOUTHAMPTON SOLENT,,,http://www.solent.ac.uk/courses/2016/postgraduate/personnel-and-development-ma/course-details.aspx,No,Media &amp; Journalism | Sport &amp; Fitness | Languages &amp; Literature | Geography Environment &amp; Sustainability | Marketing &amp; Sales | Maths &amp; Science | Law | Medicine &amp; Health | Travel &amp; Hospitality | Performing Arts | Accountancy &amp; Finance | Southampton | South East | Business &amp; Management,Southampton | Southampton
UNIVERSITY OF LINCOLN,,01522 886644,http://www.lincoln.ac.uk/home/course/INTTOUUB,No,Travel &amp; Hospitality | Medicine &amp; Health | Sport &amp; Fitness | Performing Arts | Languages &amp; Literature | Marketing &amp; Sales | Media &amp; Journalism | Maths &amp; Science | Law | Social Sciences &amp; Humanities | Lincoln,Lincoln | Distance learning
UNIVERSITY OF BRIGHTON,,,ug_guardian_course_profile,No,Architecture Building &amp; Planning | Accountancy &amp; Finance | Sport &amp; Fitness | Geography Environment &amp; Sustainability | Languages &amp; Literature | Art &amp; Design | Social Sciences &amp; Humanities | Marketing &amp; Sales | Media &amp; Journalism | Maths &amp; Science | Law | Medicine &amp; Health | Travel &amp; Hospitality | South East | Business &amp; Management,Brighton: Moulsecoomb | Brighton: Eastbourne | Eastbourne | Hastings | Brighton: Falmer | Brighton: Grand Parade | Brighton: Hastings | Falmer and the University of Sussex | Up to 3 European locations 1 sem in Eastbourne | Brighton: Falmer and a host school | Brighton | Brighton Falmer campus | Distance learning | Moulsecoomb | Brighton: Falmer and Hastings | Brighton: Falmer and Moulsecoomb | Falmer | Grand Parade and Lighthouse Brighton | Brighton: Falmer and Eastbourne | Up to 3 European locations 1 sem in Eastbourne
PLYMOUTH COLLEGE OF ART,,,http://www.plymouthart.ac.uk/courses/our-masters-programmes/,No,Media &amp; Journalism | Marketing &amp; Sales | Art &amp; Design | South West | Plymouth,Plymouth | Plymouth
CHARTERED INSTITUTE OF MANAGEMENT ACCOUNTANTS,,+44 (0) 20 8849 2251,http://www.cimaglobal.com/uk,No,Accountancy &amp; Finance | Business &amp; Management,London | London
UNIVERSITY OF GRONINGEN,,+31 50 363 3508,http://ucg@rug.nl,No,Maths &amp; Science | Social Sciences &amp; Humanities,Groningen Netherlands | Groningen Netherlands | Groningen Netherlands
EDINBURGH UNIVERSITY,,+44 (0)131 651 3064/5074,spsPG,No,Europe | Accountancy &amp; Finance | Scotland | Edinburgh,Edinburgh | Edinburgh Scotland UK | Edinburgh Scotland UK | Edinburgh Scotland UK
UNIVERSITY OF BRISTOL LAW SCHOOL,,+44 (0) 117 954 5225,http://www.bristol.ac.uk/study/postgraduate/apply/,No,Languages &amp; Literature | Law | South West | Business &amp; Management,Bristol | Bristol
THE ENGLISH TEACHER TRAINING COLLEGE OF AUSTRIA,,07614 51400 18,http://www.english-teacher-college.at,No,Europe,Austria
UNIVERSITY OF VIENNA,,(+43) 1 4277 24101,http://www.sprachenzentrum.at,No,Europe,Vienna
AVO LANGUAGE AND EXAMINATION CENTRE,,+ 359 2 943 3 943,http://www.teflcertificates-avo.com/en/celta-calendar,No,Europe | Languages &amp; Literature,Sofia Bulgaria | Sofia Bulgaria | Sofia Bulgaria
UNIVERSITY OF LEICESTER,,+44 (0)116 252 2903,https://le.ac.uk/courses/the-country-house-ma-dl,No,Accountancy &amp; Finance | Geography Environment &amp; Sustainability | Art &amp; Design | Social Sciences &amp; Humanities | Architecture Building &amp; Planning | Business &amp; Management | Architecture Building &amp; Planning,Distance learning | Distance learning
ASTON UNIVERSITY,,,http://www.aston.ac.uk,No,Accountancy &amp; Finance | Languages &amp; Literature | Art &amp; Design | Social Sciences &amp; Humanities | Marketing &amp; Sales | Maths &amp; Science | Law | Medicine &amp; Health | Travel &amp; Hospitality | Business &amp; Management,Birmingham | Online | Online
LONDON SCHOOL OF BUSINESS &amp; FINANCE,,,2000,No,Accountancy &amp; Finance | Business &amp; Management,London | Online | Online
STUDY INTERACTIVE,,,317,No,Accountancy &amp; Finance | Business &amp; Management,Online | Online
CASE EUROPE,,,,No,Europe,The Queens Hotel Leeds | Square Meeting Centre Brussels | Square Meeting Centre Brussels
UNIVERSITY OF SURREY,,,International+Tourism+Management,No,Medicine &amp; Health | Languages &amp; Literature | Social Sciences &amp; Humanities | Marketing &amp; Sales | Media &amp; Journalism | Maths &amp; Science | Law | Sport &amp; Fitness | Travel &amp; Hospitality | Performing Arts | Surrey | South East,Guildford Surrey | Guildford Surrey | Guildford Surrey
UNIVERSITY OF PORTSMOUTH,,+44 (0)23 9284 2421,http://www.port.ac.uk/courses/art-and-design/ma-graphic-design/,No,Art &amp; Design | Portsmouth | South East,Portsmouth | Portsmouth
NEW SKILLS ACADEMY,,,http://www.click4recruitment.com/gjobs1,No,Accountancy &amp; Finance | North West | Liverpool | North East | Gateshead,Online | Available in over 20 locations across the UK | Nationwide | Nationwide
INTERACTIVE DESIGN INSTITUTE,,+44 (0) 1317779321,http://bit.ly/1Ksa9jK,No,Art &amp; Design,Online | Online
EDINBURGH UNIVERSITY: COLLEGE OF ART,,+44 (0)131 650 4086,ECAPG2016,No,Art &amp; Design | Architecture Building &amp; Planning | Scotland | Edinburgh,Online | Edinburgh | Edinburgh
ROYAL HOLLOWAY UNIVERSITY OF LONDON,,,https://www.royalholloway.ac.uk/psychology/coursefinder/bscpsychologyclinicalandcognitiveneuroscience.aspx,No,Geography Environment &amp; Sustainability | Languages &amp; Literature | Social Sciences &amp; Humanities | Marketing &amp; Sales | Media &amp; Journalism | Maths &amp; Science | Law | Medicine &amp; Health | Performing Arts | Surrey | South East,London | London
SOAS,,,http://www.soas.ac.uk/admissions/pg,No,Languages &amp; Literature | Law | Art &amp; Design | Social Sciences &amp; Humanities,Central London | Central London
UNIVERSITY OF ESSEX ONLINE,,0800 0527 526,pg%20business,No,Marketing &amp; Sales | Law | Accountancy &amp; Finance | Business &amp; Management,Online | Online
DE BROC,,,1197,No,Marketing &amp; Sales,London Leeds or Birmingham | London Leeds or Birmingham | London Leeds or Birmingham
LONDON COLLEGE OF CONTEMPORARY ARTS,,,877,No,Marketing &amp; Sales | Business &amp; Management,London | London
LONDON METROPOLITAN UNIVERSITY,,,listings,No,Art &amp; Design | Accountancy &amp; Finance | Architecture Building &amp; Planning | Business &amp; Management,Aldgate London | Holloway London | London | Distance learning | Moorgate London | Moorgate London | Moorgate London
NEWCASTLE UNIVERSITY,,,,No,Art &amp; Design | North East | Newcastle,Newcastle | Newcastle
UNIVERSITY OF BUCKINGHAM,,,http://www.buckingham.ac.uk/ humanities/ma/decorativearts,No,Art &amp; Design,London | London
PLYMOUTH UNIVERSITY,,01752 585858,https://www.plymouth.ac.uk/ugopenday,No,Medicine &amp; Health | South West | Plymouth,Plymouth | Plymouth
UNIVERSITY OF DERBY ONLINE LEARNING,,+44 (0)1332 593701,UDOL_The_Guardian_2015_16,No,Medicine &amp; Health | Accountancy &amp; Finance | Business &amp; Management,Online | Online
HOME LEARNING COLLEGE,,,tsid:75619|cgn:Guardian|kw:Accounting,No,Accountancy &amp; Finance,Online | Online
IMPERIAL COLLEGE BUSINESS SCHOOL,,020 3002 5738,guardia-imp-courselist,No,Accountancy &amp; Finance | Business &amp; Management,London | Online | Online
UDEMY,,,E0IeeFhTQ3kDSRlxX1dYfAheGndOU0B2BEURclxA,No,Accountancy &amp; Finance,Online | Online
FILTERED,,020 3819 7782,http://filtered.com,No,Accountancy &amp; Finance,Online | Online
INTERNATIONAL CAREER INSTITUTE,,,5503957,No,Accountancy &amp; Finance,Online | Online
SKILLSOLOGY,,020 3322 5962,https://skillsology.com/home/pages/guardian-offers,No,Accountancy &amp; Finance,Online | Online
THE LONDON ACADEMY OF TRADING,,,1188,No,Accountancy &amp; Finance,See provider&#39;s site | Online or campus | Refer to provider site | London | London
ICAEW,,+44 (0)1908 248 250,http://icaew.com/studycfab,No,Accountancy &amp; Finance,Online | Online
CITY UNIVERSITY LONDON,,+44 (0)20 7040 0249,http://www.city.ac.uk/economics,No,Accountancy &amp; Finance,London | London
UNIVERSITY OF SOUTH WALES,,,information-fair,No,Wales | Pontypridd,South Wales | South Wales
SHEFFIELD HALLAM UNIVERSITY,,,,No,Sheffield,Sheffield
EXPERIENCE ENGLISH,,+44 (0) 208 939 0402,http://www.experienceenglish.com/our-courses/delta,No,Manchester | North West | Scotland | Edinburgh,Manchester | Hampstead (London) Edinburgh Manchester and York | Hampstead (London) Edinburgh Manchester and York
UNIVERSITY OF SALFORD,,+44 (0)161 295 4545,http://www.salford.ac.uk/nursing,No,North West | Salford,Salford | Salford
GORDON INSTITUTE OF BUSINESS SCIENCE,,+27(0) 11 771 4326,http://www.gibs.co.za/boa1601,No,Africa,South Africa Kenya and Nigeria
West Texas A&M University College of Business,,,http://www.wtamu.edu/academics/general-business-grad-program.aspx,No,West Texas A&amp;,Canyon
University of South Florida St. Petersburg College of Business,,,,No,University of,St Petersburg
University of Massachusetts Dartmouth Charlton College of Business,,,http://www.umassd.edu/charlton/,No,University of,North Dartmouth
University at Buffalo The State University of New York School of Management,,,http://www.mgt.buffalo.edu,No,University at,Buffalo
University of Central Florida College of Business Administration,,,http://www.bus.ucf.edu/,No,University of,Orlando
UCLA Anderson School of Management University of California Los Angeles,,,http://www.anderson.ucla.edu,No,UCLA Anderson,Los Angeles
Universita de Pisa Business School,,,http://www.unipi.it/index.php/english,No,Universita de,Pisa Italy
The University of Texas at El Paso College of Business Administration,,,http://www.mba.utep.edu,No,The Universit,El Paso
The University of Tennessee Martin,,,http://www.utm.edu/departments/mba/,No,The Universit,Martin Tennessee USA
The Joseph A. Butt S.J. College of Business Loyola University New Orleans,,,http://www.business.loyno.edu/,No,The Joseph A.,New Orleans
Rotterdam School of Management Erasmus University (RSM),,,http://www.rsm.nl/execed
http://www.rsm.nl/mcc,No,Rotterdam Sch,Rotterdam
Portland State University School of Business Administration,,,http://www.mba.pdx.edu,No,Portland Stat,Oregon Portland
Peking University Guanghua School of Management,,,http://mba.pku.edu.cn/english,No,Peking Univer,Beijing
Northern Michigan University College of Business,,,http://www.nmu.edu/mba,No,Northern Mich,Marquette MI
Millsaps College Else School of Management,,,http://www.mba.millsaps.edu/,No,Millsaps Coll,Jackson
Maastricht University School of Business and Economics,,,http://www.maastrichtuniversity.nl/web/Faculties/SBE/TargetGroup/Education/Professionals/MBAProgrammes.htm,No,Maastricht Un,Maastricht the Netherlands
International Institute for Learning Inc.,,,http://iil.com/leansixsigma,No,International,New York
International University of Japan Graduate School of International Managment,,,http://gsim.iuj.ac.jp/,No,International,Kokusai-cho Minami Uonuma-shi
Florida International University Chapman Graduate School of Business,,,http://imba.fiu.edu,No,Florida Inter,Miami
City University London Cass Business School,,,,No,City Universi,London
Northern Michigan University College of Business,,,http://www.nmu.edu/mba,No,Northern Mich,Marquette MI
Millsaps College Else School of Management,,,http://www.mba.millsaps.edu/,No,Millsaps Coll,Jackson
Maastricht University School of Business and Economics,,,http://www.maastrichtuniversity.nl/web/Faculties/SBE/TargetGroup/Education/Professionals/MBAProgrammes.htm,No,Maastricht Un,Maastricht the Netherlands
International University of Japan Graduate School of International Managment,,,http://gsim.iuj.ac.jp/,No,International,Kokusai-cho Minami Uonuma-shi
International Institute for Learning Inc.,,,http://iil.com/leansixsigma,No,International,New York
Florida International University Chapman Graduate School of Business,,,http://imba.fiu.edu,No,Florida Inter,Miami
City University London Cass Business School,,,,No,City Universi,London
Northern Michigan University College of Business,,,http://www.nmu.edu/mba,No,Northern Mich,Marquette MI
Millsaps College Else School of Management,,,http://www.mba.millsaps.edu/,No,Millsaps Coll,Jackson
Maastricht University School of Business and Economics,,,http://www.maastrichtuniversity.nl/web/Faculties/SBE/TargetGroup/Education/Professionals/MBAProgrammes.htm,No,Maastricht Un,Maastricht the Netherlands
International University of Japan Graduate School of International Managment,,,http://gsim.iuj.ac.jp/,No,International,Kokusai-cho Minami Uonuma-shi
International Institute for Learning Inc.,,,http://iil.com/leansixsigma,No,International,New York
Florida International University Chapman Graduate School of Business,,,http://imba.fiu.edu,No,Florida Inter,Miami
ON PURPOSE,,0203 774 8654,http://onpurpose.uk.com/,No,Business &amp; Management,London
UNIVERSITY OF HERTFORDSHIRE,,+44 (0) 1707 284800,https://ad.doubleclick.net/ddm/clk/302332229;129400727;t,No,Business &amp; Management | Hatfield,University of Hertfordshire de Havilland campus | University of Hertfordshire de Havilland campus | University of Hertfordshire de Havilland campus
UNIVERSITY OF OXFORD DEPARTMENT FOR CONTINUING EDUCATION,,,,No,Archaeology | Landscape Archaeology | Archaeological Practice | Middle Eastern Archaeology | Funerary Archaeology | Greek Archaeology | Writing | Script Writing | Biography Writing | Non-Fiction Writing,Oxford OX1 2JA | You study this on your computer | Reading RG1 5AQ | Oxford OX1 2JA | Oxford OX1 2JA
Bharatiya Vidya Bhavan,,,,No,Archaeology | Asian Archaeology,London W14 9HE
Oxford Learning College,,,,No,Archaeology | Roman Archaeology | Middle Eastern Archaeology,This is a distance learning course | You study this on your computer
Aberystwyth University,,,,No,Antique Collecting | Book Conservation,Newtown SY16 3PW
Mary Ward Centre,,,,No,Archaeology | Archaeology Of Cultures | Writing | Travel Writing | Biography Writing | Non-Fiction Writing | Web design | Dreamweaver,London WC1N 3AQ | London WC1V 7JU | London WC1N 3AQ | London WC1N 3AQ
UK Learning College,,,,No,Animation | Maya,You study this on your computer
Travel Writing Workshops,,,,Yes,Writing | Travel Writing,London SE17 3WF
New Writing South,,,,No,Writing | Writing For Radio,Brighton BN1 1UT
Bristol Folk House Co-Operative,,,,No,Writing | Travel Writing | Script Writing,Bristol BS1 5JG | Bristol BS1 5JG
CITY LIT,,,,No,Writing | Typography | Travel Writing | Writing For Newspapers | Antique Collecting | Book Conservation | Archaeology | Middle Eastern Archaeology | Greek Archaeology | Paleography | Print & Publishing | Script Writing | Publishing | Screenplay Writing | Academic Writing | Comedy Writing | Web design | All Web design,London WC2B 4BA | London WC2B 4BA | London WC2B 4BA
OFCOURSE LEARNING LTD,,,http://ofcourse.co.uk/?p=4028,Yes,Writing | Travel Writing | Publishing | Web design | All Web design,You study this on your computer | You study this on your computer
West Dean College,,,,No,Writing | Travel Writing | Writing For Newspapers,Chichester PO18 0QZ | Chichester PO18 0QZ
The Travel Writing Workshop,,,,Yes,Writing | Travel Writing,London W1T 6AQ
Arvon Foundation,,,,No,Writing | Writing For Radio | Writing For Children | Screenplay Writing | Short Story Writing | Comedy Writing | Biography Writing | Non-Fiction Writing,Beaworthy EX21 5NS | Hebden Bridge HX7 6DF | Craven Arms SY7 0JA | Craven Arms SY7 0JA | Hebden Bridge HX7 6DF
Kingston Adult Education,,,,No,Writing | Writing For Children,Surbiton KT5 9AL
Richmond Adult Community College,,,,No,Writing | Writing For Children | Writing For Newspapers | Comedy Writing | Biography Writing | Web design | Apps,Richmond TW9 2RE | Richmond TW9 2RE | Richmond TW9 2RE
eDistance Learning,,,,Yes,Writing | Writing For Children | Archaeology | Middle Eastern Archaeology | Proof Reading,This is a distance learning course | You study this on your computer
SOUTH THAMES COLLEGE,,,,No,Writing | Writing For Children,London SW18 2PP
Write Story Books For Children,,,,Yes,Writing | Writing For Children,You study this on your computer
Study Smart Online,,,,Yes,Writing | Writing For Newspapers | Technical Authorship | Proof Reading | Biography Writing,You study this on your computer | You study this on your computer
Stonebridge Associated Colleges,,,,No,Writing | Writing For Newspapers | Web design | Dreamweaver,You study this on your computer | You study this on your computer
VITA Online training & education,,,,Yes,Writing | Writing For Newspapers,You study this on your computer
Online Learning Academy,,,,Yes,Writing | Writing For Newspapers,This is a distance learning course
ContentETC,,,,Yes,Writing | Writing For Newspapers,You study this on your computer
KENT ADULT EDUCATION,,,,No,Writing | Writing For Newspapers | Publishing | Short Story Writing | Biography Writing | Web design | Apps,Broadstairs CT10 2BS | Tunbridge Wells TN1 1LS | Canterbury CT2 8QA | Canterbury CT1 2RA | Maidstone ME14 1LH
Henshall Centre Limited,,,,Yes,Writing | Writing For Newspapers,London EC1R 5EN
London College of Communication University of the Arts London,,,,No,Writing | Writing For Newspapers,Southwark SE1 6SB
Cadcourses,,,,Yes,Animation | Maya,You study this on your computer
COURSES FOR SUCCESS,,,,Yes,Animation | Maya | Writing | Screenplay Writing | Text Formatting | Technical Authorship | Editorial | Web design | Dreamweaver | Apps,You study this on your computer | You study this on your computer
Writers Bureau (The),,,,Yes,Writing | Writing For Newspapers | Proof Reading | Biography Writing | Non-Fiction Writing,This is a distance learning course | This is a distance learning course
Escape Studios,,,,No,Animation | Maya,Hammersmith And Fulham W14 0DA
