Company Name,E-Mail,Phone Number,Website,Direct book,Categories,Locations
Old Dominion University College of Business and Public Administration,,,http://bpa.odu.edu/,No,Old Dominion,Norfolk | Norfolk
Opus College of Business,,,http://www.stthomas.edu/business/,No,Opus College,Minneapolis | TMH 166 1000 Lasalle AvenueMinneapolis Minnesota 55403United States
Open Yale Courses,,,http://oyc.yale.edu/,No,Open Yale Cou,Connecticut | Connecticut
Ohio University College of Business,,,http://aspnet.cob.ohio.edu/isms/cob.aspx,No,Ohio Universi,Athens | Athens
One Month Rails,,,https://onemonthrails.com,No,One Month Rails,
OnlineITcourses.com,,,http://www.onlineitcourses.com,No,OnlineITcours,6803 EC | 6803 EC
NUS Business School,,,http://bschool.nus.edu/,No,NUS Business,Singapore | Mochtar Riady BuildingSingapore 119245Singapore
Oakland University School of Business Administration,,,http://www.oakland.edu/,No,Oakland Unive,Rochester | Oakland Center 2200 N. Squirrel RoadRochester Michigan 48309United States
Northern Kentucky University College of Business,,,http://cob.nku.edu/,No,Northern Kent,Highland Heights | Highland Heights
NPTEL,,,http://nptel.iitm.ac.in/courses.php?disciplineId=101,No,NPTEL,
Northern Michigan University College of Business,,(906) 227-1000(906) 227-1396,http://www.nmu.edu/mba,No,Northern Mich,Marquette MI | 1401 Presque Isle AvenueMarquette Michigan 49885United States
OEM Office Elearning Menu,,,http://www.officeelearningmenu.co.uk,No,OEM Office El,London | London
NYU School of Continuing and Professional Studies,,,http://www.scps.nyu.edu/,No,NYU School of,NY NY United States | 2001 Newburg Rd.Louisville Kentucky 40205United States | NY NY United States | NY NY United States
Northeastern Illinois University College of Business and Management,,,http://www.neiu.edu/Academics/College%20of%20Business_Management/College_of_Business_%26_Management.html,No,Northeastern,Chicago | 5500 N St Louis AveChicago Illinois 60625United States
North Carolina State University Poole College of Management,,,http://poole.ncsu.edu/,No,North Carolin,Raleigh | Raleigh
North Carolina Central University,,,http://www.nccu.edu,No,North Carolin,St. Durham | 1801 Fayetteville StreetDurham North Carolina 27707United States
Northern Illinois University College of Business,,,http://www.cob.niu.edu,No,Northern Illi,DeKalb | DeKalb
Naveen Jindal School of Management,,,http://jindal.utdallas.edu/,No,Naveen Jindal,Richardson | Richardson
Moore School of Business,,,http://mooreschool.sc.edu/,No,Moore School,Columbia | 1705 College StreetColumbia South Carolina 29208United States
New York Institute of Technology School of Management,,,http://www.nyit.edu,No,New York Inst,New York | Northern Blvd. 268 Wheatly Road (Mail)Old Westbury New York 11568United States
Neeley School of Business,,,http://www.neeley.tcu.edu/,No,Neeley School,Fort Worth | 2900 Lubbock Street  Suite 309Fort Worth Texas 76109United States
Monte Ahuja College of Business,,,http://www.csuohio.edu/business/,No,Monte Ahuja C,Cleveland | 2121 Euclid Ave KB 1409Cleveland Ohio 44115United States
Montclair State University,,,http://www.montclair.edu,No,Montclair Sta,Montclair | One Normal AvenueMontclair New Jersey 07043United States
MIT Sloan School of Management,,,http://mitsloan.mit.edu/,No,MIT Sloan Sch,Cambridge | Room E60-100 77 Massachusetts Ave.Cambridge Massachusetts 02139United States
Missouri State University College of Business,,,http://business.missouristate.edu/default.htm,No,Missouri Stat,Springfield | Springfield
Mitchell College of Business,,,http://www.southalabama.edu/mcob/,No,Mitchell Coll,Mobile | West Tower (Long-Term Care Hospital) 3Rd. Floor Conference Room B 5600 Girby RoadMobile Alabama 36693United States
Mississippi University for Women College of Business and Professional Studies,,,http://web2.muw.edu/index.php/business/,No,Mississippi U,Columbus | Columbus
Mihaylo College of Business and Economics California State University,,,http://www.business.fullerton.edu/,No,Mihaylo Colle,
Millsaps College Else School of Management,,,http://www.mba.millsaps.edu/,No,Millsaps Coll,Jackson
Mississippi State University College of Business,,,http://business.msstate.edu/,No,Mississippi S,Starkville | Starkville
MIB School of Management,,,http://www.mib.edu/mba,No,MIB School of,Trieste Italy | Trieste Italy | Trieste Italy
Michael G. Foster School of Business,,,http://www.foster.washington.edu/Pages/home.aspx,No,Michael G. Fo,Seattle | Seattle
Michael F. Price College of Business,,,http://www.ou.edu/price,No,Michael F. Pr,Norman | 660 Parrington OvalNorman Oklahoma 73019United States
McCombs School of Business,,,http://www.mccombs.utexas.edu/,No,McCombs Schoo,Austin | Austin
Mendoza College of Business,,,http://business.nd.edu/,No,Mendoza Colle,Notre Dame | Notre Dame
Meinders School of Business,,,http://msb.okcu.edu/,No,Meinders Scho,Oklahoma City | Oklahoma City
McDonough School of Business,,,http://msb.georgetown.edu/,No,McDonough Sch,Northwest Washington | Northwest Washington
McCallum Graduate School of Business,,,http://www.bentley.edu/graduate,No,McCallum Grad,Waltham | 175 Forest StreetWaltham Massachusetts 02452United States
MBA@UNC,,,http://onlinemba.unc.edu.,No,MBA@UNC,Chapel Hill | Chapel Hill
Mays Business School,,,http://mays.tamu.edu/,No,Mays Business,College Station | 440 WehnerCollege Station Texas 77843United States
Massey Graduate School of Business Belmont University,,,http://www.belmont.edu,No,Massey Gradua,Nashville | 1900 Belmont Blvd.Nashville Tennessee 37212United States
Martin V. Smith School of Business & Economics,,,http://business.csuci.edu/,No,Martin V. Smi,Camarillo | Camarillo
Mason School of Business,,,http://mason.wm.edu/,No,Mason School,Williamsburg | Tyler Hall Room 107Williamsburg Virginia 23187United States
Martha and Spencer Love School of Business,,,http://www.elon.edu/e-web/academics/business/,No,Martha and Sp,Elon | Campus Box 2700Elon North Carolina 27244United States
Martin J. Whitman School of Management,,,http://whitman.syr.edu/,No,Martin J. Whi,Syracuse | 721 University Avenue  Suite 415Syracuse New York 13244United States
Marriott School of Management,,,http://marriottschool.byu.edu/,No,Marriott Scho,Provo | Provo
Manderson Graduate School of Business,,,http://manderson.cba.ua.edu,No,Manderson Gra,Tuscaloosa | Tuscaloosa
Marshall School of Business,,,http://www.marshall.usc.edu/,No,Marshall Scho,Los Angeles | Los Angeles
Marquette University College of Business Administration,,,http://business.marquette.edu/,No,Marquette Uni,Milwaukee | Milwaukee
Marshall Goldsmith School of Management,,,http://www.alliant.edu/asm/index.php,No,Marshall Gold,San Diego | One Beach St.San Francisco California 94133United States
Maine Business School,,,http://umaine.edu/business/,No,Maine Busines,Orono | 16 Central StreetBangor Maine 04401United States
Maastricht University School of Business and Economics,,,http://www.maastrichtuniversity.nl/web/Faculties/SBE/TargetGroup/Education/Professionals/MBAProgrammes.htm,No,Maastricht Un,Maastricht the Netherlands
Maharishi University of Management Department of Business Administration,,,http://www.mum.edu/business,No,Maharishi Uni,Fairfield | 1000 North 4Th StreetFairfield Iowa 52557United States
Lutgert College of Business,,,http://www.fgcu.edu/cob/,No,Lutgert Colle,Fort Myers | 10501 FGCU Blvd. SouthFort Myers Florida 33965United States
Lundy-Fetterman School of Business,,,http://www.campbell.edu/business/,No,Lundy-Fetterm,Buies Creek | 56 Main StreetBuies Creek North Carolina 27506United States
Lynchburg College School of Business and Economics,,,http://www.lynchburg.edu,No,Lynchburg Col,Lynchburg | 1501 Lakeside DriveLynchburg Virginia 24501United States
Lubin School of Business,,,http://www.pace.edu/lubin/,No,Lubin School,New York | 1 Pace PlazaNew York New York 10038United States
Lumpkin College of Business & Applied Sciences,,,http://www.eiu.edu/lumpkin/,No,Lumpkin Colle,Charleston | 600 Lincoln Ave.Charleston Illinois 61920United States
Loyola University Chicago Quinlan School of Business,,,http://www.luc.edu/quinlan/,No,Loyola Univer,Chicago | 2160 South 1St AvenueMaywood Illinois 60153United States
SAP Training,,,https://training.sap.com,No,SAP Training,
Louisiana Tech University College of Business,,,http://business.latech.edu/,No,Louisiana Tec,Ruston | Ruston
Long Island University College of Management,,,http://liu.edu/com,No,Long Island U,Brookville | 720 Northern BoulevardBrookville New York 11548United States
Loyola Marymount University College of Business,,,http://cba.lmu.edu/,No,Loyola Marymo,Los Angeles | Los Angeles
Liberty University,,,http://www.liberty.edu,No,Liberty Unive,Lynchburg | 1971 University Blvd.Lynchburg Virginia 24502United States
Liautaud Graduate School Of Business,,,http://business.uic.edu/,No,Liautaud Grad,Chicago | Chicago
Microsoft Learning,,,http://learning.microsoft.com/Manager/Catalog.aspx,No,Microsoft Lea,
Lipscomb University College of Business,,,http://www.lipscomb.edu/business,No,Lipscomb Univ,Nashville | 3901 Granny White PikeNashville Tennessee 37204United States
Lender School of Business,,,http://www.quinnipiac.edu/academics/colleges-schools--departments/school-of-business--engineering/,No,Lender School,Hamden | 275 Mount Carmel AvenueHamden Connecticut 06518United States
George Mason University School of Management,,,http://www.som.gmu.edu/,No,George Mason,Fairfax | Enterprise Hall Suite 008 4400 University DriveFairfax Virginia 22030United States
Florida International University Chapman Graduate School of Business,,,http://imba.fiu.edu,No,Florida Inter,Miami
Fisher College of Business,,,http://fisher.osu.edu/,No,Fisher Colleg,Columbus | Columbus
Fairfield University's Charles F. Dolan School of Business,,,http://www.fairfield.edu/dsb/,No,Fairfield Uni,Fairfield | Athletics 1073 North Benson RoadFairfield Connecticut 06824United States
Fisher Graduate School of International Business,,,http://www.miis.edu/academics/programs/mba,No,Fisher Gradua,Monterey | 460 Pierce StreetMonterey California 93940United States
Florida A&M University School of Business and Industry,,,http://www.famu.edu,No,Florida A&amp;M U,Tallahassee | 1500 South Martin L. King  Jr. Blvd.Tallahassee Florida 32307United States
E-Vision Software,,,http://www.evision-software.com/,No,E-Vision Soft,The Hague The Netherlands | 9595 Six Pines Drive Suite 8210The Woodlands Texas 77380United States | The Hague The Netherlands | The Hague The Netherlands
Euro*MBA,,,http://www2.euromba.org/Default.aspx,No,Euro*MBA,Maastricht The Netherlands | Maastricht The Netherlands
Erivan K. Haub School of Business,,,http://www.sju.edu/int/academics/hsb/,No,Erivan K. Hau,Philadelphia | 5600 City Ave.Philadelphia Pennsylvania 19131United States
Eli Broad College of Business,,,,No,Eli Broad Col,East Lansing | 3535 Forest RoadLansing Michigan 48910United States
E. Philip Saunders College of Business,,,http://saunders.rit.edu/,No,E. Philip Sau,Rochester | 105 Lomb Memorial DriveRochester New York 14623United States
Elizabeth McDowell Lewis College of Business,,,http://muwww-new.marshall.edu/cob/,No,Elizabeth McD,Huntington | Huntington
Eller College of Management,,,http://www.eller.arizona.edu/,No,Eller College,Tucson | Tucson
E. J. Ourso College of Business,,,http://business.lsu.edu/,No,E. J. Ourso C,Baton Rouge | Baton Rouge
Edward S. Ageno School of Business,,,,No,Edward S. Age,San Francisco | San Francisco
Eugene W. Stetson School of Business and Economics,,,http://business.mercer.edu/,No,Eugene W. Ste,Atlanta | Atlanta
Eberhardt School of Business,,,http://www.pacific.edu/Academics/Schools-and-Colleges/Eberhardt-School-of-Business.html,No,Eberhardt Sch,Stockton | 155 Fifth StSan Francisco California 94103United States
edX,,,https://www.edx.org/,No,edX,Cambridge | 141 Portland St 9th FloorCambridge Massachusetts 02139United States
E. Craig Wall Sr. College of Business Administration,,,http://www.coastal.edu/business/,No,E. Craig Wall,Conway | 642 Century CircleConway South Carolina 29526United States
ECU College of Business,,,http://www.ecu.edu/cs-bus/,No,ECU College o,Greenville | 1500 Greenville Centre 2200 S. Charles Blvd.Greenville North Carolina 27858United States
East Tennessee State University College of Business and Technology,,,http://www.etsu.edu/cbat/,No,East Tennesse,Johnson City | 807 University PkwyJohnson City Tennessee 37614United States
Duke University's Fuqua School of Business,,,http://www.fuqua.duke.edu/,No,Duke Universi,Durham | Durham
Drake University College of Business,,,http://www.cbpa.drake.edu,No,Drake Univers,Des Moines | Des Moines
David Eccles School of Business,,,http://www.business.utah.edu/,No,David Eccles,Salt Lake City | 1645 E. Campus Center Drive  Room 401Salt Lake City Utah 84112United States
Eastern Mediterranean University,,,http://www.emu.edu.tr/defaulteng.asp,No,Eastern Medit,Gazimagusa North Cyprus | Gazimagusa North Cyprus | Gazimagusa North Cyprus
Daniels College of Business,,,http://daniels.du.edu/,No,Daniels Colle,Denver | Denver
C. T. Bauer College of Business,,,http://bauer.uh.edu/,No,C. T. Bauer C,Houston | 4800 Calhoun Melcher Hall Room 256Houston Texas 77004United States
Denver's Business School,,,http://www.ucdenver.edu/academics/colleges/business/Pages/business-school.aspx,No,Denver&#x27;s Busi,Denver | 13001 E. 17th Place Campus Box B119Aurora Colorado 80045United States
Creighton University Online,,,http://online.creighton.edu/,No,Creighton Uni,Omaha | Omaha
Crummer Graduate School of Business,,,http://www.rollins.edu/mba/,No,Crummer Gradu,Winter Park | 1000 Holt Ave.   2722Winter Park Florida 32789United States
Creighton University College of Business,,,http://business.creighton.edu/,No,Creighton Uni,Omaha | Omaha
Columbia Business School,,,http://www8.gsb.columbia.edu/,No,Columbia Busi,New York | New York
Consortium Institute of Management and Business Analysis (CIMBA),,,http://www.cimba.it,No,Consortium In,Asolo | 108 PBB Suite C300Iowa City Iowa 52242United States
Corvinus University of Budapest,,,http://corvinus-mba.hu/,No,Corvinus Univ,Budapest | Budapest
Cornell University School of Continuing Education,,,http://www.sce.cornell.edu/,No,Cornell Unive,Ithaca NY United States | Ithaca NY United States | Ithaca NY United States
Colorado State University College of Business,,,http://biz.colostate.edu/,No,Colorado Stat,Fort Collins | 501 West Laurel StreetFort Collins Colorado 80523United States
Clark University Graduate School of Management,,,http://www.clarku.edu/gsom/,No,Clark Univers,Worcester | 950 Main Street  Box B28Worcester Massachusetts 01610United States
Clemson University of Business and Behavioral Science,,,http://www.clemson.edu/cbbs/index.html,No,Clemson Unive,Clemson | 391 College Avenue Suite 402Clemson South Carolina 29634United States
Coles College of Business,,,http://coles.kennesaw.edu/,No,Coles College,Kennesaw | Kennesaw
Dartmouth College Tuck School of Business,,,http://www.tuck.dartmouth.edu,No,Dartmouth Col,Hanover | Hanover
Cloudera University,,,http://www.cloudera.com,No,Cloudera Univ,Palo Alto | 220 Portage AvePalo Alto California 94306United States
Christos M. Cotsakos College of Business,,,http://www.wpunj.edu/ccob,No,Christos M. C,Wayne | 300 Pompton RoadWayne New Jersey 07470United States
City University London Cass Business School,,,,No,City Universi,London
City University of Seattle School of Management,,,http://www.ghc.edu,No,City Universi,Seattle | 1620 Edward P Smith DrAberdeen Washington 98520United States
Coursera,,,https://www.coursera.org/,No,Coursera,Mountain View CA | 381 E. Evelyn AvenueMountain View California 94041United States | Mountain View CA | Mountain View CA
Charles H. Lundquist College of Business,,,http://lcb.uoregon.edu/,No,Charles H. Lu,Eugene | Eugene
Chicago State University College of Business,,,http://www.csu.edu/business/,No,Chicago State,Chicago | 9501 S. King Dr.Chicago Illinois 60628United States
Carroll School of Management,,,http://www.bc.edu/schools/csom/,No,Carroll Schoo,Chestnut Hill | 38 Commonwealth AvenueChestnut Hill Massachusetts 02467United States
Carlson School of Management,,,http://www.csom.umn.edu/,No,Carlson Schoo,Minneapolis | 321 19Th Ave. S.Minneapolis Minnesota 55455United States
Carnegie Mellon University,,,http://oli.cmu.edu/,No,Carnegie Mell,Pittsburgh PA United States | 5000 Forbes Ave.Pittsburgh PennsylvaniaUnited States | Pittsburgh PA United States | Pittsburgh PA United States
Bill Greehey School of Business,,,http://www.stmarytx.edu/business/,No,Bill Greehey,San Antonio | 1 Camino Santa MariaSan Antonio Texas 78228United States
Beacom School of Business,,,http://www.usd.edu/business/,No,Beacom School,Vermillion | Vermillion
Benedictine University College of Business,,,http://www.ben.edu/academic_programs/business/,No,Benedictine U,Lisle | 5700 College RoadLisle Illinois 60532United States
Bellevue University College of Business,,,http://www.bellevue.edu/resources/colleges/business.aspx,No,Bellevue Univ,Bellevue | 1000 Galvin Road SouthBellevue Nebraska 68005United States
Benedictine College School of Business,,,http://www.benedictine.edu/academics/majors-minors/school-business,No,Benedictine C,Atchison | 1020 North Second StreetAtchison Kansas 66002United States
Babcock Graduate School of Management,,,http://business.wfu.edu/,No,Babcock Gradu,Winston-Salem | Winston-Salem
Barry Kaye College of Business,,,http://business.fau.edu/,No,Barry Kaye Co,Boca Raton | Boca Raton
Berklee College of Music,,,http://www.berkleemusic.com/,No,Berklee Colle,Boston MA United States | 855 Boylston StreetBoston Massachusetts 02215United States | Boston MA United States | Boston MA United States
Barney School of Business,,,http://www.hartford.edu/barney/,No,Barney School,West Hartford | 200 Bloomfield AvenueWest Hartford Connecticut 06117United States
Atkinson Graduate School of Management,,,http://www.willamette.edu/mba/,No,Atkinson Grad,Salem | 900 State St.Salem Oregon 97301United States
Azusa Pacific University School of Business and Management,,,http://www.apu.edu,No,Azusa Pacific,Azusa | 901 East Alosta AvenueAzusa California 92821United States
Arcadia University,,,http://www.arcadia.edu/academic/default.aspx?id=4376,No,Arcadia Unive,Glenside | 450 S. Easton RoadGlenside Pennsylvania 19038United States
Athens University of Economics & Business,,,http://www.imba.aueb.gr,No,Athens Univer,Athens | Athens
Angelo State University College of Business,,,http://www.angelo.edu/dept/business/,No,Angelo State,San Angelo | ASU Station 2601 W. Ave. NorthSan Angelo Texas 76909United States
Andreas School of Business,,,,No,Andreas Schoo,Miami Shores | Miami Shores
Ancell School of Business,,,,No,Ancell School,Danbury | Danbury
Alfred Lerner College of Business & Economics,,,http://www.lerner.udel.edu/,No,Alfred Lerner,Newark | Newark
Anderson School of Management,,,http://www.mgt.unm.edu/,No,Anderson Scho,Albuquerque | Albuquerque
Barton School of Business,,,http://www.wichita.edu/thisis/academics/business/,No,Barton School,Wichita | 1845 FairmountWichita Kansas 67260United States
alison,,,http://alison.com,No,alison,Galway | 30 St George StreetMayfair London W1S 2FHUnited Kingdom
Albers School of Business and Economics,,,http://www.seattleu.edu/albers/,No,Albers School,Seattle | 901 12Th AvenueSeattle Washington 98122United States
Air Academy Associates,,,http://airacad.com,No,Air Academy A,Colorado | 1650 Telstar Drive  Suite 110Colorado Springs Colorado 80920United States
West Texas A&M University College of Business,,,http://www.wtamu.edu/academics/general-business-grad-program.aspx,No,West Texas A&amp;,Canyon
University of South Florida St. Petersburg College of Business,,,,No,University of,St Petersburg
University of Massachusetts Dartmouth Charlton College of Business,,,http://www.umassd.edu/charlton/,No,University of,North Dartmouth
University of Central Florida College of Business Administration,,,http://www.bus.ucf.edu/,No,University of,Orlando
Universita de Pisa Business School,,,http://www.unipi.it/index.php/english,No,Universita de,Pisa Italy
University at Buffalo The State University of New York School of Management,,,http://www.mgt.buffalo.edu,No,University at,Buffalo
UCLA Anderson School of Management University of California Los Angeles,,,http://www.anderson.ucla.edu,No,UCLA Anderson,Los Angeles
The University of Tennessee Martin,,,http://www.utm.edu/departments/mba/,No,The Universit,Martin Tennessee USA
The University of Texas at El Paso College of Business Administration,,,http://www.mba.utep.edu,No,The Universit,El Paso
The Joseph A. Butt S.J. College of Business Loyola University New Orleans,,,http://www.business.loyno.edu/,No,The Joseph A.,New Orleans
Rotterdam School of Management Erasmus University (RSM),,,http://www.rsm.nl/execed
http://www.rsm.nl/mcc,No,Rotterdam Sch,Rotterdam
Portland State University School of Business Administration,,,http://www.mba.pdx.edu,No,Portland Stat,Oregon Portland
Peking University Guanghua School of Management,,,http://mba.pku.edu.cn/english,No,Peking Univer,Beijing
Northern Michigan University College of Business,,,http://www.nmu.edu/mba,No,Northern Mich,Marquette MI
Millsaps College Else School of Management,,,http://www.mba.millsaps.edu/,No,Millsaps Coll,Jackson
West Texas A&M University College of Business,,,http://www.wtamu.edu/academics/general-business-grad-program.aspx,No,West Texas A&amp;,Canyon
University of South Florida St. Petersburg College of Business,,,,No,University of,St Petersburg
University of Massachusetts Dartmouth Charlton College of Business,,,http://www.umassd.edu/charlton/,No,University of,North Dartmouth
University of Central Florida College of Business Administration,,,http://www.bus.ucf.edu/,No,University of,Orlando
Universita de Pisa Business School,,,http://www.unipi.it/index.php/english,No,Universita de,Pisa Italy
University at Buffalo The State University of New York School of Management,,,http://www.mgt.buffalo.edu,No,University at,Buffalo
UCLA Anderson School of Management University of California Los Angeles,,,http://www.anderson.ucla.edu,No,UCLA Anderson,Los Angeles
The University of Tennessee Martin,,,http://www.utm.edu/departments/mba/,No,The Universit,Martin Tennessee USA
The Joseph A. Butt S.J. College of Business Loyola University New Orleans,,,http://www.business.loyno.edu/,No,The Joseph A.,New Orleans
The University of Texas at El Paso College of Business Administration,,,http://www.mba.utep.edu,No,The Universit,El Paso
Rotterdam School of Management Erasmus University (RSM),,,http://www.rsm.nl/execed
http://www.rsm.nl/mcc,No,Rotterdam Sch,Rotterdam
Portland State University School of Business Administration,,,http://www.mba.pdx.edu,No,Portland Stat,Oregon Portland
Peking University Guanghua School of Management,,,http://mba.pku.edu.cn/english,No,Peking Univer,Beijing
Northern Michigan University College of Business,,,http://www.nmu.edu/mba,No,Northern Mich,Marquette MI
Millsaps College Else School of Management,,,http://www.mba.millsaps.edu/,No,Millsaps Coll,Jackson
Maastricht University School of Business and Economics,,,http://www.maastrichtuniversity.nl/web/Faculties/SBE/TargetGroup/Education/Professionals/MBAProgrammes.htm,No,Maastricht Un,Maastricht the Netherlands
Leeds School of Business,,,http://leeds.colorado.edu/,No,Leeds School,Boulder | Boulder
LeBow College of Business,,,http://www.lebow.drexel.edu/,No,LeBow College,Philadelphia | Philadelphia
Lee Business School,,,http://business.unlv.edu/,No,Lee Business,Las Vegas | Las Vegas
La Salle School of Business,,,http://www.lasalle.edu/schoolofbusiness/,No,La Salle Scho,Philadelphia | Philadelphia
KU School of Business,,,http://www.business.ku.edu/,No,KU School of,Lawrence | Lawrence
Leavey School of Business,,,http://www.scu.edu/business/,No,Leavey School,Santa Clara | Santa Clara
Krannert School of Management,,,http://www.krannert.purdue.edu/,No,Krannert Scho,West Lafayette | West Lafayette
Kogod School of Business,,,http://www.american.edu/kogod/,No,Kogod School,Washington | Washington
King Graduate School of Business,,,http://www.monroecollege.edu/king,No,King Graduate,Bronx | Bronx
Lally School of Management & Technology,,,http://lallyschool.rpi.edu/,No,Lally School,Troy | Troy
KIMEP University,,,http://www.kimep.kz/mba/,No,KIMEP University,Almaty | Almaty
Kellstadt Graduate School of Business,,,http://kellstadt.depaul.edu/,No,Kellstadt Gra,Chicago | Chicago
Keystone Success,,,http://keystonesuccess.com,No,Keystone Success,Oude Wetering | Oude Wetering
Kent State University College of Business Administration and Graduate Programs Office,,,http://www.kent.edu/business/,No,Kent State Un,Kent | Kent
Kellogg School of Management,,,http://www.kellogg.northwestern.edu/,No,Kellogg Schoo,Evanston | Evanston
Kean University College of Business & Public Administration,,,http://www.kean.edu/~cbpa/Welcome.html,No,Kean Universi,Union | Union
JWU College of Business,,,http://www.jwu.edu/business/,No,JWU College o,Providence | Providence
Kelley School of Business,,,http://kelley.iu.edu/,No,Kelley School,Bloomington | Bloomington
Jump 22,,,http://jump22.co.za,No,Jump 22,Cape Town | Cape Town
Joseph M. Katz Graduate School of Business,,,http://www.business.pitt.edu/index.php,No,Joseph M. Kat,Pittsburgh | Pittsburgh
Kania School of Management,,,http://elearning.scranton.edu/mba/online-mba-programs,No,Kania School,Scranton | Scranton
Jon M. Huntsman School of Business,,,http://huntsman.usu.edu/,No,Jon M. Huntsm,Logan | Logan
John L. Grove College of Business,,,http://www.ship.edu/business/,No,John L. Grove,Shippensburg | Shippensburg
Kelley College of Business,,,http://www.hsutx.edu/academics/kelley,No,Kelley Colleg,Abilene | Abilene
John H. Sykes College of Business,,,http://www.ut.edu/business/,No,John H. Sykes,Tampa | Tampa
John H. Goddard School of Business & Economics,,,http://www.weber.edu/SBE,No,John H. Godda,Utah  84408-3801 | Utah  84408-3801
